{
  "meta": {
    "schema_version": "1.0.0",
    "report_id": "demo-audit-001",
    "report_revision": 1,
    "revision_reason": "匿名合成演示首版",
    "run_id": "RUN-DEMO-001",
    "generated_at": "2026-09-07T09:00:00+08:00",
    "language": "zh-CN",
    "mode": "combined",
    "execution_status": "partial",
    "data_origin": "synthetic_demo",
    "title": "合成研究：干预 A 对指标 Y 的影响"
  },
  "scope": {
    "objective": "核对合成论文的核心疗效主张、摘要与表格一致性、P 值复算及重复测量处理。",
    "input_scope": ["合成正文文本", "合成作者回复", "合成源数据"],
    "paper_versions": ["P-DEMO-1 v1.0"],
    "selected_checks": ["摘要—表格一致性", "缺失值分母", "P 值复算", "实验单位与重复测量"],
    "exclusions": ["未核查图像完整性", "未进行外部重复实验"],
    "limitations": ["这是匿名合成材料，只用于验证工作流与前端", "缺少动物—测量值真实配对表，层级分析被阻塞"],
    "checklist_defined": true
  },
  "papers": [
    {
      "paper_id": "P-DEMO-1",
      "title": "干预 A 对指标 Y 的影响：一项合成实验",
      "doi": null,
      "version": "v1.0",
      "publication": { "venue": "Synthetic Methods Journal", "published_at": "2026-08-01" },
      "version_relations": []
    }
  ],
  "materials": [
    {
      "material_id": "M-PDF-1",
      "paper_id": "P-DEMO-1",
      "material_type": "article",
      "source": "local:materials/synthetic-paper.txt",
      "file_name": "materials/synthetic-paper.txt",
      "sha256": "sha256:6d1d46a5aa360f5fade20790136eb4ff05d5b1b29ca29c4b6e622e445e22b982",
      "access_status": "obtained",
      "text_read": true,
      "images_viewed": false,
      "accessed_at": "2026-09-07T08:10:00+08:00",
      "read_at": "2026-09-07T08:30:00+08:00",
      "unavailable_reason": null
    },
    {
      "material_id": "M-SHEET-1",
      "paper_id": "P-DEMO-1",
      "material_type": "source_data",
      "source": "local:materials/synthetic-source-data.csv",
      "file_name": "materials/synthetic-source-data.csv",
      "sha256": "sha256:ff01a36bb13c24d19057c63c7444a45f1210206b86f3422ae1cd9891ceac4289",
      "access_status": "obtained",
      "text_read": true,
      "images_viewed": false,
      "accessed_at": "2026-09-07T08:12:00+08:00",
      "read_at": "2026-09-07T08:42:00+08:00",
      "unavailable_reason": null
    },
    {
      "material_id": "M-PAIRING-1",
      "paper_id": "P-DEMO-1",
      "material_type": "raw_record",
      "source": "requested-but-unavailable",
      "file_name": null,
      "sha256": null,
      "access_status": "unavailable",
      "text_read": false,
      "images_viewed": false,
      "accessed_at": null,
      "read_at": null,
      "unavailable_reason": "未提供动物与重复测量的对应表"
    },
    {
      "material_id": "M-REPLY-1",
      "paper_id": "P-DEMO-1",
      "material_type": "review_history",
      "source": "local:materials/synthetic-author-reply.txt",
      "file_name": "materials/synthetic-author-reply.txt",
      "sha256": "sha256:0808b932c7730465d5717ad93f42613f129bc02f1af59d4a359afd7ad12e7a07",
      "access_status": "obtained",
      "text_read": true,
      "images_viewed": false,
      "accessed_at": "2026-09-07T08:15:00+08:00",
      "read_at": "2026-09-07T08:55:00+08:00",
      "unavailable_reason": null
    }
  ],
  "claims": [
    {
      "claim_id": "C-EFFICACY-1",
      "paper_id": "P-DEMO-1",
      "statement": "干预 A 在第 8 周降低指标 Y。",
      "claim_type": "causal",
      "supporting_evidence_ids": ["E-TABLE-1", "E-PVALUE-1"],
      "contradicting_evidence_ids": ["E-ABSTRACT-1"],
      "assessment": "方向得到表格与作者声明方法下的复算支持，但摘要效应量抄录错误，且重复测量的独立性仍待澄清。",
      "boundaries": ["仅限合成样本与第 8 周终点", "不支持等效性或长期疗效外推"]
    },
    {
      "claim_id": "C-SAFETY-1",
      "paper_id": "P-DEMO-1",
      "statement": "两组不良事件发生率相近。",
      "claim_type": "descriptive",
      "supporting_evidence_ids": ["E-MISSING-1"],
      "contradicting_evidence_ids": [],
      "assessment": "分母差异由预先说明的缺失随访解释，当前未发现摘要与补充表冲突。",
      "boundaries": ["描述性比较，不代表已证明安全性等效"]
    }
  ],
  "evidence": [
    {
      "evidence_id": "E-ABSTRACT-1",
      "material_id": "M-PDF-1",
      "evidence_type": "paper_text",
      "locator": { "kind": "text", "section": "Abstract", "description": "第 3 行" },
      "content": "摘要报告第 8 周组间差为 18 个单位。",
      "directly_verified": true,
      "run_id": "RUN-DEMO-001",
      "analysis_id": null
    },
    {
      "evidence_id": "E-TABLE-1",
      "material_id": "M-PDF-1",
      "evidence_type": "table",
      "locator": { "kind": "text", "table": "Table 2", "section": "Results", "description": "第 6 行" },
      "content": "Table 2 报告校正后组间差为 12 个单位。",
      "directly_verified": true,
      "run_id": "RUN-DEMO-001",
      "analysis_id": null
    },
    {
      "evidence_id": "E-SOURCE-1",
      "material_id": "M-SHEET-1",
      "evidence_type": "source_data",
      "locator": { "kind": "spreadsheet", "sheet": "synthetic-source-data.csv", "range": "B2:C13" },
      "content": "CSV 第 2–13 行给出两组各 6 个合成汇总观测值。",
      "directly_verified": true,
      "run_id": "RUN-DEMO-001",
      "analysis_id": null
    },
    {
      "evidence_id": "E-PVALUE-1",
      "material_id": "M-SHEET-1",
      "evidence_type": "calculation",
      "locator": { "kind": "spreadsheet", "sheet": "synthetic-source-data.csv", "range": "B2:C13" },
      "content": "按作者声明的双侧检验复算 P=0.0486，与论文 P=0.049 在发表精度内一致。",
      "directly_verified": true,
      "run_id": "RUN-DEMO-001",
      "analysis_id": "A-PVALUE-1"
    },
    {
      "evidence_id": "E-MISSING-1",
      "material_id": "M-PDF-1",
      "evidence_type": "paper_text",
      "locator": { "kind": "text", "section": "Missing data", "description": "第 9 行" },
      "content": "安全性分析排除两名没有任何随访记录的参与者，因此使用安全性集分母。",
      "directly_verified": true,
      "run_id": "RUN-DEMO-001",
      "analysis_id": null
    },
    {
      "evidence_id": "E-REPLY-1",
      "material_id": "M-REPLY-1",
      "evidence_type": "review_history",
      "locator": { "kind": "text", "section": "Response 3", "description": "作者回复第 3 条" },
      "content": "作者说明旧稿的组别颜色已在 v1.0 中更正；本次直接查看 v1.0 图例与表格一致。",
      "directly_verified": true,
      "run_id": "RUN-DEMO-001",
      "analysis_id": null
    },
    {
      "evidence_id": "E-FIGLEGEND-1",
      "material_id": "M-PDF-1",
      "evidence_type": "caption",
      "locator": { "kind": "text", "figure": "Figure 2", "section": "Figure 2 legend", "description": "第 8–9 行" },
      "content": "当前 v1.0 图注明确标注 intervention A 为绿色、control 为灰色，并与 Table 2 对应。",
      "directly_verified": true,
      "run_id": "RUN-DEMO-001",
      "analysis_id": null
    }
  ],
  "checks": [
    {
      "check_id": "CH-CONSISTENCY-1",
      "paper_id": "P-DEMO-1",
      "claim_ids": ["C-EFFICACY-1"],
      "check_type": "摘要—表格一致性",
      "input_evidence_ids": ["E-ABSTRACT-1", "E-TABLE-1"],
      "method": "逐项核对终点、时间点、比较方向、单位和效应量。",
      "status": "fail",
      "result": "同一第 8 周组间差在摘要为 18、Table 2 为 12；其余口径一致。",
      "blocked_reason": null,
      "not_applicable_reason": null,
      "execution_records": [{ "executed_at": "2026-09-07T09:00:00+08:00", "actor": "review-agent", "tool": "manual full-text comparison", "output_ref": "report.json#issues/I-ABSTRACT-1" }]
    },
    {
      "check_id": "CH-PVALUE-1",
      "paper_id": "P-DEMO-1",
      "claim_ids": ["C-EFFICACY-1"],
      "check_type": "P 值复算",
      "input_evidence_ids": ["E-SOURCE-1", "E-PVALUE-1"],
      "method": "按作者声明的双侧检验复算，并按三位小数比较舍入。",
      "status": "pass",
      "result": "复算 P=0.0486，舍入后为 0.049，与发表值一致。",
      "blocked_reason": null,
      "not_applicable_reason": null,
      "execution_records": [{ "executed_at": "2026-09-07T09:02:00+08:00", "actor": "review-agent", "tool": "Node.js 22 synthetic calculation", "output_ref": "artifacts/recalculate-pvalue.mjs" }]
    },
    {
      "check_id": "CH-UNIT-1",
      "paper_id": "P-DEMO-1",
      "claim_ids": ["C-EFFICACY-1"],
      "check_type": "实验单位与重复测量",
      "input_evidence_ids": ["E-SOURCE-1"],
      "method": "检查观测值与动物身份的嵌套关系，并计划动物级敏感性分析。",
      "status": "blocked",
      "result": null,
      "blocked_reason": "缺少动物—测量值真实配对表，不能臆造聚类关系。",
      "not_applicable_reason": null,
      "execution_records": []
    },
    {
      "check_id": "CH-MISSING-1",
      "paper_id": "P-DEMO-1",
      "claim_ids": ["C-SAFETY-1"],
      "check_type": "分母与缺失值",
      "input_evidence_ids": ["E-MISSING-1"],
      "method": "核对安全性集定义与各处分母。",
      "status": "pass",
      "result": "分母差异由方法中的缺失随访规则解释。",
      "blocked_reason": null,
      "not_applicable_reason": null,
      "execution_records": [{ "executed_at": "2026-09-07T09:03:00+08:00", "actor": "review-agent", "tool": "full-text comparison", "output_ref": "report.json#evidence/E-MISSING-1" }]
    },
    {
      "check_id": "CH-EQUIV-1",
      "paper_id": "P-DEMO-1",
      "claim_ids": ["C-SAFETY-1"],
      "check_type": "等效性检验",
      "input_evidence_ids": [],
      "method": "判断论文是否提出等效性主张。",
      "status": "not_applicable",
      "result": null,
      "blocked_reason": null,
      "not_applicable_reason": "论文仅作描述性报告，未提出或实施等效性研究。",
      "execution_records": []
    }
  ],
  "issues": [
    {
      "issue_id": "I-ABSTRACT-1",
      "title": "摘要效应量与 Table 2 不一致",
      "claim_ids": ["C-EFFICACY-1"],
      "author_statement": "摘要报告第 8 周组间差为 18 个单位。",
      "observation": "同一终点在 Table 2 报告为 12 个单位。",
      "source_description": "v1.0 合成正文 Abstract 与 Results—Table 2。",
      "evidence_ids": ["E-ABSTRACT-1", "E-TABLE-1"],
      "direct_source_read": true,
      "verification_steps": ["核对时间点和终点定义", "核对单位与调整模型", "比较摘要与表格效应量"],
      "verification_input": "v1.0 合成正文 Abstract 与 Table 2",
      "verification_method": "全文逐项比对",
      "actual_output": "摘要 18；Table 2 为 12",
      "published_result": "同一份正式版内同时存在两个值",
      "alternative_explanations": [
        { "explanation": "两个值来自不同时间点或不同模型", "checked": true, "outcome": "not_supported", "reason": "两处均明确写第 8 周校正后组间差。" },
        { "explanation": "正常四舍五入", "checked": true, "outcome": "not_supported", "reason": "差异为 6 个单位，不能由显示精度解释。" }
      ],
      "assumptions": [],
      "missing_materials": [],
      "status": "confirmed",
      "status_reason": "同一版本两个精确定位位置对同一统计量报告不同值。",
      "evidence_strength": "high",